{
    "schema_version":  2,
    "workflow":  {
                     "phase":  "feasibility"
                 },
    "identifiers":  {
                        "toi":  null,
                        "aliases":  [
                                        "TOI-7665"
                                    ],
                        "tic":  null
                    },
    "candidate_id":  "toi-7665",
    "notes":  "Screened in followup-2026-07 campaign; source evidence frozen in toi-3492.01/legacy-project/docs/.",
    "publication":  "none",
    "created_at":  "2026-08-04T00:00:00Z",
    "lifecycle":  {
                      "state_since":  "2026-08-04T00:00:00Z",
                      "reason":  "Screened out: existing imaging and CTOI contribution",
                      "state":  "stopped"
                  },
    "scientific_disposition":  "unknown"
}