{
    "schema_version":  2,
    "workflow":  {
                     "phase":  "feasibility"
                 },
    "identifiers":  {
                        "toi":  "4161.01",
                        "aliases":  [
                                        "TOI-4161.01",
                                        "TOI-4161"
                                    ],
                        "tic":  "345914562"
                    },
    "candidate_id":  "toi-4161.01",
    "notes":  "Screened in followup-2026-07 campaign; source evidence frozen in toi-3492.01/legacy-project/docs/.",
    "publication":  "none",
    "created_at":  "2026-08-04T00:00:00Z",
    "lifecycle":  {
                      "state_since":  "2026-08-04T00:00:00Z",
                      "reason":  "High-priority warm-Jupiter candidate from 2026-07 screening",
                      "state":  "paused"
                  },
    "scientific_disposition":  "candidate"
}