{
    "schema_version":  2,
    "workflow":  {
                     "phase":  "feasibility"
                 },
    "identifiers":  {
                        "toi":  null,
                        "aliases":  [
                                        "TOI-7698"
                                    ],
                        "tic":  "241577487"
                    },
    "candidate_id":  "toi-7698",
    "notes":  "Screened in followup-2026-07 campaign; source evidence frozen in toi-3492.01/legacy-project/docs/.",
    "publication":  "none",
    "created_at":  "2026-08-04T00:00:00Z",
    "lifecycle":  {
                      "state_since":  "2026-08-04T00:00:00Z",
                      "reason":  "Resumed campaign: primary target unpaused for vetting",
                      "state":  "active"
                  },
    "scientific_disposition":  "candidate"
}