{
    "schema_version":  2,
    "candidate_id":  "toi-3495.01",
    "identifiers":  {
                        "toi":  "3495.01",
                        "tic":  "241577488",
                        "aliases":  [
                                        "TOI-3495.01",
                                        "TOI-3495"
                                    ]
                    },
    "lifecycle":  {
                      "state":  "active",
                      "state_since":  "2026-08-03T00:00:00Z",
                      "reason":  "Intake started; canonical catalog metadata not yet verified."
                  },
    "workflow":  {
                     "phase":  "intake"
                 },
    "scientific_disposition":  "unknown",
    "publication":  "none",
    "created_at":  "2026-08-03T00:00:00Z",
    "notes":  "Verify the canonical TIC identifier and ephemeris from a primary catalog before data acquisition or scientific interpretation."
}